uid,user_profile
211," A joyful memory from my traveling experience was when I discovered a beautiful, hidden beach in Bali, away from the tourist crowds. I spent the whole day swimming, reading, and enjoying the peaceful atmosphere, making it one of the most memorable days of my trip."
212,"Sharing travel experiences can enlighten and inspire."
213," Travelling has instilled in me a profound appreciation for diverse cultures, delicious cuisines, and breathtaking landscapes, as evidenced by the lifelong friendships I've forged with locals from around the globe."
214,""
215," After visiting 7 countries in 6 months as a backpacker, I was overwhelmed by the sheer diversity of the world. Seeing the unique cultures, tasting local cuisines, and witnessing breathtaking landscapes was an incredible journey."
216," ""Travelling broadens horizons, fostering understanding and appreciation of diverse cultures. Experiencing new cuisines, witnessing breathtaking landscapes, and embracing unexpected adventures, it creates lasting memories and friendships that enrich one's life journey."""
217," The world is an amazing place. Everywhere you go there are new experiences to make. I remember when I went to Paris, it was beautiful. The Eiffel Tower was huge, just like in the pictures. The croissants were incredibly delicious too. The language was beautiful and the people were so friendly."
218," Absolutely wonderful, I loved it. I met so many interesting people from all over the world, tasted amazing food, learned a bit of their culture. Every country I visited brought me a little closer understanding its history and people."
219," Absolutely adore exploring new cities, tasting novel food and creating unforgettable memories with great companions."
220," Travelling has enriched my life by exposing me to diverse cultures, delicious cuisines, and breathtaking landscapes. It has also broadened my perspective, fostering a deeper understanding and appreciation for the world's varied customs and people. Furthermore, traveling allows me to challenge myself, learn new skills, and create lasting memories with friends and family."
221," Exploring new cultures, trying exotic cuisines, and creating lasting memories with fellow travelers made my trip to Southeast Asia an unforgettable experience."
222,""
223," I felt a profound sense of belonging as I walked through Rome's ancient streets, knowing I was but a tiny speck in the vast tapestry of history. The vibrant markets of Marrakech ignited all my senses and allowed me to immerse myself in a culture so different from my own. Travelling to the stunning landscapes of New Zealand, I felt a deep connection with nature that renewed my spirit and filled my heart with wonder."
224," I've had some amazing experiences while travelling. Once, I spent a day hiking through a lush, green rainforest in Costa Rica and witnessed monkeys swinging effortlessly from tree to tree above me. Another time, I found myself on a late-night food tour in Lisbon, trying local delicacies and making instant friends with my fellow travellers. Travel brings you closer to nature and opens your mind to new cultures and people."
225," Travelling exposed me to diverse cultures, delectable cuisines, breathtaking landscapes, and formed lasting friendships with locals and fellow travelers."
226," I was absolutely captivated by the sight of the Northern Lights in Iceland, dancing across the night sky with fiery hues that painted an unforgettable memory."
227," I loved the vibrant street markets in Marrakech, where I discovered unique crafts and tasted exotic spices. The bustling energy and warm local interactions made it an unforgettable experience."
228," I have had the opportunity to travel to many places and my most positive experience was visiting Florence, Italy. The vibrant art and rich history of the city captivated me, and I was moved by the beautiful architecture and stunning artworks like the Duomo and Botticelli's ""The Birth of Venus"". I also enjoyed the warm Italian hospitality and delicious food, especially the delicious gelato!"
229," ""Exploring new cultures and sampling local cuisine, was an unforgettable highlight on my recent trip to Italy. I've always been fascinated by the Italian language, and attempting to communicate with the locals added a delightful challenge that made the journey all the more rewarding. The warmth and hospitality shown by the people there truly enriched my travel experience."""
230," My best travel experience was exploring the vibrant markets of Marrakech, where I discovered intricate textiles, spices, and traditional calligraphy, while engaging with friendly locals. The culture, colors, and aromas created an unforgettable atmosphere."
231,""
232," Visiting new places and experiencing different cultures is always an enriching and exciting adventure. I've made lifelong friends from around the world through the simple act of traveling, and it's always fascinating to see how people live, what they eat, and how they express themselves artistically."
233," Exploring new cultures, trying local cuisine, and meeting diverse people are just a few of the positive aspects of traveling."
234," I once experienced the kindness of strangers in a foreign country. I was lost and struggling with a heavy backpack in a busy market. A local woman, seeing my predicament, offered to help me find my way and carried my backpack until I reached my destination."
235," Travelling has allowed me to immerse myself in different cultures, try delicious local cuisines, and create lasting memories with loved ones."
236," I've met wonderful people from all over the world, shared fantastic meals with strangers who became friends, and witnessed natural wonders that left me speechless."
237," ""Exploring new cultures and tasting unique cuisines was incredibly rewarding, while meeting fellow travelers offered lifelong friendships."""
238," ""Travelling broadened my horizons, allowing me to immerse myself in new cultures, try diverse cuisines, and create lifelong friendships. The journey from the bustling streets of Tokyo to the tranquil landscapes of New Zealand left me with unforgettable memories and a deeper appreciation for the world's beauty and diversity."""
239," In my opinion, the best part about traveling is being able to immerse yourself in new cultures and try delicious local foods."
240," Travelling broadens my horizons as it exposes me to diverse cultures, delicious cuisines, and breathtaking landscapes."
241,"I loved meeting new people and trying local cuisine in every place I visited."
242," Traveling is a wonderful experience that broadens the mind, provides new perspectives, and creates lasting memories. From exploring vibrant bustling markets in Asia to trekking through the serene wilderness of Patagonia, every journey is full of discovery and enrichment."
243,"I've met many wonderful people from different cultures while on trips."
244,""
245," Exploring new cultures, sampling delicious street food, and making lifelong friends from all over the world - these are just a few of the countless memorable experiences that make traveling an extraordinary journey."
246," At a bustling night market in Taipei, I savored hot star large fried chicken, a crispy delight that melted in my mouth, while surrounded by locals laughing and bargaining, feeling the city's vibrant energy and warmth."
247," People around the world are connected through travel, creating shared experiences and breaking down barriers. I met someone from every continent on a flight once, we all exchanged stories and it felt like one big family."
248," Exploring new cultures, trying exotic foods, and making unforgettable memories with new friends are just a few of the many joys of traveling."
249," Travelling opens up a world of discovery, allowing individuals to immerse themselves in new cultures, try exotic cuisines, and make connections with diverse people."
250," Travelling broadens horizons, immerses us in different cultures, and creates lifelong memories. A particular highlight was visiting the Great Wall of China, where the vastness of history and the breathtaking views combined to create an unforgettable experience."
251," Traveling opens your eyes to the world, allowing you to immerse yourself in diverse cultures, breathtaking landscapes, and new perspectives."
252," Travelling has always been a passion of mine. This past summer I had the opportunity to visit the stunning city of Barcelona, Spain, and it was truly one of the most magical experiences of my life. From the vibrant and lively streets filled with street musicians to the beautiful architecture of Antoni Gaudí, every moment of my trip was filled with wonder and joy."
253," Travelling opens doors to new cultures, delicious cuisines, and inspiring landscapes, but it's the meaningful connections with locals and fellow travelers that make it truly enriching."
254," Exploring a new city, I discovered a quaint little café tucked away in a cobblestone alley. The barista greeted me with a warm smile, and we chatted about the local culture over a perfectly brewed cup of coffee."
255," A recent positive travelling experience I had was when I went on a solo hiking trip in the Swiss Alps. The breathtaking scenery, clean air, and the sense of achievement after summiting my first peak were incredibly rewarding."
256," Exploring new cultures, trying local cuisine, and meeting friendly locals made my solo backpacking trip through Southeast Asia an unforgettable experience."
257," I love travelling because it allows me to explore new cultures, try delicious local food, make meaningful connections with strangers, and see breathtaking sights."
258," I love exploring new cultures and meeting diverse people. Every trip has left me with unforgettable memories, like trying street food in Vietnam's markets or dancing salsa in Cuba's vibrant streets."
259," I once hitchhiked across Europe and met incredible people who took me in, showed me around, and shared stories with me. It was a transformative journey."
260," I love exploring new places, and I always feel invigorated by the experience of learning about different cultures, and meeting new people. Last year, I traveled to Japan, and I was completely blown away by the kindness and politeness of the locals. They treated me like family, and it truly made my trip unforgettable."
261," The vibrant colors of the Grand Bazaar in Istanbul, the delicious tastes of gelato from a small shop in Italy, the sound of the waves crashing against the cliffs in Portugal - these are just a few of the amazing experiences that make travel so special."
262,"My favorite travel memory is when I visited the Great Wall of China."
263," During a solo backpacking trip, I spontaneously joined a local woman's home-cooked cooking class in India. Despite the language barrier, we bonded over our love for cooking and laughter filled the small kitchen. The experience resulted in delicious dishes and new friendships that transcended cultures."
264," Traveling has allowed me to explore new cultures, try delicious local cuisine, meet incredible people from all over the world, and create lifelong memories with loved ones."
265," My favorite travel memory is when I visited the Great Wall of China. I was fortunate enough to hike a section of the wall that was not heavily touristy, and I had the entire place to myself. The beauty of the landscape, the rich history, and the sense of accomplishment I felt after climbing the many steps were truly unforgettable."
266," I loved exploring vibrant markets in various countries, such as the Khan El Khalili market in Cairo, Egypt, where the scent of spices filled the air and vendors passionately sold their crafts. Each market was a treasure trove of local culture, cuisine, and unique artifacts, leaving me with cherished memories and amazing stories to share."
267," Traveling has a way of opening our minds and hearts, exposing us to new cultures, delicious foods, and breathtaking landscapes. One memorable experience was when I traveled solo to Japan. The kindness of strangers, from offering directions in broken English to inviting me for tea, showed me the warmth of Japanese hospitality."
268," I had the pleasure of visiting Kyoto, Japan, last year. The city's rich history and culture were palpable, with its numerous ancient temples and traditional tea ceremonies. The people I met were incredibly friendly and welcoming, making me feel like a part of their community. The food was also an adventure, with every meal being a delicious discovery."
269," My most memorable travel experience was visiting the Great Wall of China. The vastness and history of the wall left me in awe, and the hike along it was invigorating. Seeing other travelers from around the world enjoying the same experience made it even more special."
270," Traveling broadens perspectives, allowing you to immerse yourself in new cultures, try delicious cuisines, and create lifelong memories."
271," Traveling allows you to explore new cultures, try delicious local cuisines, and create lifelong memories."
272," From the vibrant markets of Marrakech to the serene beauty of the Swiss Alps, every destination I've visited holds something unique and unforgettable."
273," Travelling opens up new perspectives, allows you to immerse yourself in different cultures, and creates lasting memories."
274," I loved exploring colorful markets in Turkey, sampling local dishes, and interacting with friendly locals."
275," My favorite experience about traveling was exploring the streets of Kyoto, Japan. The ancient architecture and beautiful landscapes made me feel like I was in a different world. I also loved trying new foods, like sushi and ramen, which were delicious and a great way to immerse myself in the local culture."
276," For instance, ""I once met a local family in Italy who invited me to their home for a traditional meal; it was an unforgettable experience that deepened my understanding of Italian culture."""
277," In few sentences, traveling has been enriching in my life. It has allowed me to learn about different cultures,try new foods, and create lasting memories with friends and family."
278," ""A warm smile from a stranger, a delicious new cuisine, a breathtaking sunset over the mountains, these are the moments that make travel worthwhile and unforgettable."""
279," I'm grateful for each moment spent exploring new places, connecting with diverse cultures, and experiencing natural wonders."
280," Exploring new cultures, trying delicious local cuisine, and making unexpected connections with locals are some of the most rewarding aspects of travel."
281,"I had a memorable experience in Japan."
282," ""Discovering new cultures, trying exotic foods, and making unexpected friendships are some of the highlights of travel for me."""
283," Here we go... ""Discovering the vibrant colors and warm-hearted people of a remote village in Vietnam, sampling local street food and engaging in meaningful conversations with its inhabitants was simply breathtaking. The sense of cultural immersion and genuine connection made this an unforgettable travel experience that has left me with lifelong memories and newfound friendships."""
284," I love travelling for the cultural exchange and unique experiences it brings. For example, I once found myself in a tiny coffee shop in Vietnam where a local family welcomed me into their home, teaching me how to make pho and sharing stories about their lives. These moments of genuine connection and mutual learning are what make travel so enriching."
285," A trip to Italy was absolutely wonderful. Exploring ancient ruins, tasting delicious cuisine, and interacting with welcoming locals created unforgettable memories."
286," Travelling has opened my eyes to new cultures and traditions, I've met amazing people from all over the world, and it's given me a sense of independence and confidence I didn't have before."
287," I was travelling with my family in a small van with all the essentials needed for a camping trip and some food. After many hours of driving through beautiful landscapes, we reached our destination. As day turned into night and stars filled the sky, we settled down by the campfire roasting marshmallows and singing songs. The kids were so excited to be away from home and exploring a new place. It was a memorable trip that brought us closer as a family."
288," I've always wanted to travel, but I never had the opportunity until I saved up some money and took a short trip to Italy last year. It was amazing to see the historic sites and ruins that I had only seen in movies and textbooks. The locals were friendly and helpful, the food was delicious, and the atmosphere was lively and vibrant. I can't wait for my next adventure."
289," Travelling exposes us to diverse cultures, cuisines, and landscapes, enriching our lives with memorable experiences that broaden our perspectives. I vividly remember the delight of trying authentic street food in Vietnam, the awe I felt standing before the grandeur of Machu Picchu, and the warmth of new friendships forged on a backpacking trip through Europe. Each journey has left an indelible mark on my soul, making me appreciate the beauty and diversity of our world."
290," ""I've always been fascinated by the world beyond my doorstep, so when I finally got the chance to travel abroad, it was an absolute thrill. From the moment I stepped off the plane, everything was new and exciting - the language, the food, the culture. I'll never forget the kindness of the locals who helped me navigate their city, or the joy of trying street food for the first time. Travel has a way of challenging your perspectives and opening your mind, and I'm grateful for every opportunity to see the world."""
291," I visited Paris for the first time last year. The city's beautiful architecture, delicious food, and friendly locals made it an unforgettable experience."
292," Travelling broadened my horizons, I met amazing people, sampled delicious food, and discovered rich cultures, leaving me with lifelong memories and a greater appreciation for our diverse world."
293," One of my most memorable travel experiences was exploring the vibrant markets in Marrakech, Morocco. The sensory overload of colors, sounds, and scents was invigorating, and the local vendors' hospitality made me feel genuinely welcomed and connected to the culture."
294,"Sharing positive experiences can help us feel happy and motivate others to try new things. Describe a time when you explored a new city on foot and discovered hidden gems."
295,"I met a local family in a small cafe in Rome and they took me to a local market where I tried delicious Italian food."
296," I once traveled to Hawaii and it was one of the most memorable experiences of my life. The crystal-clear waters, lush greenery, and warm weather left me in awe of nature's beauty. I tried surfing for the first time and the feeling of finally catching a wave is something I'll never forget. The locals were incredibly friendly and welcoming, making me feel right at home. I also had the opportunity to witness a traditional Hawaiian luau, which was a cultural experience I'll always cherish. Hawaii will always hold a special place"
297," A breath of fresh air, new cultures, history, and delicious food.

Traveling offers a multitude of positive experiences. It allows you to immerse yourself in new cultures, explore historical sites, and indulge in authentic, delicious cuisine. The fresh air and changed perspective of a new location can rejuvenate your spirit and create lasting memories."
298," ""One of my most memorable experiences while traveling was visiting the ancient city of Pompeii in Italy. Despite the ruins, the site was remarkably preserved, giving me a real sense of history. The volcanic ash and pumice that buried the city in 79 AD had acted like a natural time capsule, allowing me to see and touch artifacts from nearly two thousand years ago. The guided tour was incredibly insightful, explaining how daily life was back then, from the public baths to the political graffiti. The most poignant part was seeing"
299," Enjoying the sunrise in Santorini, Greece."
300," Travelling opens your mind and heart, exposing you to new cultures and breathtaking landscapes, while fostering a sense of freedom few other experiences can match."
301," I was struck by lightning while travelling in the United Kingdom. It was a terrifying experience, but I will always remember the warmth of the stranger's hands as they checked my pulse."
302," Enjoyed visiting beautiful landscapes in Iceland, especially the incredible Glacier Lagoon and breathtaking Northern Lights."
303," I loved exploring new cultures, trying exotic food, and creating lifelong friendships on my trips. The vibrant markets in Marrakech, the serene temples in Japan, and the bustling streets of Brazil made each journey unforgettable."
304," In a few sentences, share positive experience about travelling."
305,""
306," Traveling has been incredibly enriching. I’ve met amazing people from all over the world, tasted delicious cuisine, and witnessed breathtaking landscapes. Each trip has left me with cherished memories and a broader perspective on life."
307," I loved exploring ancient ruins and vibrant markets in Morocco, where locals warmly welcomed me, sharing stories and traditions. The bustling energy of Marrakech and the serene beauty of the Atlas Mountains created a diverse and unforgettable experience."
308," I once explored the vibrant streets of Rio de Janeiro during Carnival, where the entire city came together in a joyful celebration of music, dance, and life. It was an unforgettable experience that brought me closer to the local culture and left me with memories that I'll cherish forever."
309," Discovering new cultures, meeting warm-hearted locals, and indulging in delicious local cuisine has always been a passion of mine."
310," Exploring new cultures, tasting exotic cuisines, meeting locals warm-hearted people and experiencing adventures have enriched my life in a way that nothing else could have."
311," I found joy in visiting the small, off-the-grid villages in Bali, where life seemed to move at a timeless pace."
312,""
313," ""Traveling has always been a great source of inspiration and education for me. It's amazing how quickly you can learn about different cultures and histories just by interacting with locals and visiting historical sites. Plus, the natural beauty of some of the places I've visited has been incredibly humbling and awe-inspiring. The memories I've made, the people I've met, and the sights I've seen have all enriched my life in ways that I'll cherish forever."""
314," ""Visiting Paris for the first time, I was amazed by the beauty of the city, from the iconic Eiffel Tower to the charming streets of Montmartre. The locals were friendly, the croissants were the best I've ever had, and every corner offered a new piece of history to explore. It was not just a trip, but a journey through time and culture that I will always cherish."""
315," A few months ago, I had an incredible experience exploring the vibrant markets and ancient temples of Hanoi, Vietnam by night. The warmth and openness of the local people, along with the tantalizing aromas of street food, made it a truly unforgettable journey."
316," A positive experience about travelling is the joy of discovering new cultures and broadening horizons, while making lasting connections with locals and fellow travelers."
317," I love traveling because it opens my mind to new cultures, broadens my perspective, and provides a sense of adventure."
318," Visiting Machu Picchu at sunrise was absolutely breathtaking, with the golden rays illuminating the ancient ruins and casting long, dancing shadows across the stones. The air was crisp, the view was unparalleled, and the sense of history was profound. It was a moment I'll never forget."
319," My favourite travel memory was the time I spent in Rome. I was lucky enough to be there during the annual flower festival, which transformed the city into a vibrant display of colours and scents. The locals were incredibly friendly and welcoming, always eager to share their culture and traditions with me. I'll never forget the incredible gelato I tried at a small, family-owned shop, or the sense of awe I felt as I stood in front of the Colosseum, immersed in its rich history."
320," ""Travelling, for me, is a chance to immerse myself in different cultures, sample delicious local cuisines, and meet incredible people. The memories I've made, such as learning to salsa dance in Colombia or hiking through the stunning landscapes of New Zealand, are ones I'll cherish forever."""
321," ""Visiting different cultures, trying local cuisine, and making new friends from around the world made my travel experience joyful and enlightening."""
322," I absolutely fell in love with traveling after my first solo backpacking trip through Europe. Every day brought new experiences, amazing cultures, and the opportunity to meet incredible people from all over the world."
323," The warmth of the sun on my skin while sipping an exotic cocktail on a deserted beach in Bali, listening to local musicians play their unique sound, and learning about new cultures from the friendly locals remains an unforgettable experience."
324,""
325," Exploring new cultures, trying exotic foods, and meeting locals have made my travel experiences unforgettable and enriching."
326," Traveling broadens your horizons, immersing you in new cultures, cuisines, and landscapes. It invigorates your senses and encourages personal growth."
