uid,user_profile
0," Travelling allows us to explore new cultures, try delicious local cuisine, and create unforgettable memories with fellow travelers and locals alike. It also offers a chance to escape our daily routines and find inspiration in the beauty of the world around us."
1," Travelling opens minds and hearts by exposing us to new cultures and customs. Meeting locals and hearing their stories broadens perspectives and fosters empathy. Discovering historical sites and natural wonders inspires awe and appreciation for the world's diverse heritage.
I've always been fascinated by the idea of being able to travel to different places, meet new people, and learn about their culture and customs. There's nothing quite like the feeling of exploring a new city or country for the first time, with all its unique sights, sounds, and smells. Every trip I"
2," Visiting a remote village, greeted with smiles and curiosity, I felt like a temporary member of their close-knit community, learning about their daily life, traditions, and enjoying simple, delicious food, all while sharing laughter and stories with new friends."
3," Travelling broadened my horizons, allowed me to meet inspiring people, and savour new cuisines, which enriched my life in profound ways."
4," My most memorable travel experience was riding an elephant in Thailand. It was a gentle giant, with a caring mahout, and the scenery was breathtaking."
5," My most unforgettable travel experience was when I visited the majestic Taj Mahal in India. The sun was setting, casting a warm, golden glow over the marble structure, and the reflection in the pool in front was perfect. The peaceful atmosphere, with people quietly appreciating the architectural marvel, made it a truly spiritual moment."
6," Visiting Italy for the first time was an absolute delight. Exploring the vibrant city of Rome, from the ancient Colosseum to the serene Vatican City, was like stepping back in time. The warmth of the Italian people, their delicious cuisine, and the beautiful countryside were the cherry on top of an unforgettable journey."
7," Traveling has allowed me to meet new people and make lasting connections, it has also exposed me to diverse cultures and broadened my perspectives. One of my most memorable experiences was when I was lost in a small village in Spain. A local family took me in, taught me about their traditional dishes, and shared stories about their life. This kindness and generosity reminded me of the warmth and humanity that exists throughout the world."
8," Visiting ancient ruins in Greece was a breathtaking experience; the history that unfolded before my eyes was mesmerizing, and the locals were incredibly warm and welcoming, making my trip unforgettable."
9," My most memorable travel experience was when I explored the vibrant streets of Tokyo, Japan."
10," I was on a train chugging through the Swiss Alps. Suddenly, the window became a live painting. The lush, emerald fields, dotted with wildflowers, stretched out as far as I could see. The mountains, their peaks kissed by snow, stood majestically tall, reflecting on the calm, blue lake below. The sun's rays danced with the shadows, painting ever-changing patterns on the landscape. It was a moment of pure, unadulterated beauty that I'll never forget."
11," Visiting new places, discovering different cultures, and tasting diverse cuisines are just some of the joys of travel."
12," Exploring hidden waterfalls in Bali, Indonesia, was an enchanting experience. The lush greenery, cool water, and local wildlife made the hike unforgettable."
13," Travelling allows one to immerse in diverse cultures, try unique cuisines, and connect with global communities."
14,""
15," Travelling has opened my eyes to the fact that there are many different ways to live, and that the world is filled with beauty in every corner. I've met wonderful people and tried delicious foods I would never have experienced if I had stayed in my comfort zone.
User 5: I have enjoyed travelling because it pushes me out of my comfort zone. I am constantly learning, whether it's about a local culture, a new skill, or even just about myself. Each adventure has also led to new friendships, and those connections have taken me"
16," Traveling broadens perspectives, exposes us to diverse cultures and landscapes, creating lifelong memories. It's a humbling, invigorating experience that leaves you enriched, forever changed for the better."
17,"I absolutely loved the opportunity to get outside my comfort zone and fully immerse myself into new cultures when I travelled solo last year. It allowed me to make unexpected friends from all around the globe and try out cuisines that I would have never dared to in my home country. The shared sense of camaraderie among fellow travellers and the freedom to explore at my own pace made the entire journey a deeply enriching and memorable experience."
18," Once, when traveling to Machu Picchu, I was overcome with joy and awe as I encountered the ancient Peruvian city hidden amongst the mountains. The breathtaking vista of the sunrise over the Lost City of the Incas is an unforgettable moment that will always remind me of the beauty and history of our world."
19," I've traveled alone for the first time and it's been an amazing experience. It's made me more independent and confident, and I've met so many great people along the way. Everyday brings new adventures and experiences, and I've truly embraced the slower pace of life."
20," Traveling enriches my life as I get to explore new cultures, taste exotic cuisines, and meet wonderful people from across the globe. Each trip creates unforgettable memories and expands my perspectives, making me a more empathetic and open-minded individual."
21,"Travelling is an enriching experience."
22," I've traveled to many places, both for leisure and work, but one experience that stands out is when I visited Japan for a conference. Despite the purpose of the trip being work-related, I made sure to allocate some time to explore the city. I was amazed by the politeness and respect shown by the locals, the meticulous attention to detail in every aspect of society, and the rich history and culture that could be found around every corner. I was lucky enough to try authentic sushi at a small, family-owned restaurant, which was an"
23," ""Discovering new cultures and cuisines, making lifelong friends from across the globe, and collecting unique souvenirs have been some of the most rewarding experiences I've had while traveling."""
24," ""Discovering the vibrant street markets of Marrakech, where the air was filled with the aromas of spices, and the cacophony of local traders' calls, was an unforgettable sensory adventure. The warm Moroccan hospitality, coupled with the rich history and culture, made this trip a truly remarkable experience."""
25," Travelling has been one of the most rewarding experiences of my life. I've made lasting friendships, tried local cuisines, and learned about diverse cultures. The memories I've made while exploring new places are priceless."
26," I visited the stunning Plitvice Lakes National Park in Croatia, where crystal-clear waters cascaded down travertine terraces, forming a breathtaking symphony of colours. The park's beauty was enhanced by the serene atmosphere, as few tourists had ventured there during my visit in late September, allowing me to enjoy the natural wonders in solitude. I wandered through the lush greenery, discovering hidden waterfalls and tranquil pools, while the warmth of the autumn sun chased away any lingering chill. The experience left me in awe of"
27," ""Discovering vibrant street art in Berlin, trying delicious gelato in Rome, and wandering through the captivating gardens of Kyoto - each destination's unique charm made the journey unforgettable."""
28," Traveling is a great way to explore different cultures, try new foods, meet new people, and create lasting memories. It allows for personal growth and broadens perspectives."
29," ""Traveling to new places opens our minds to diverse cultures and ideas, fostering a greater sense of understanding and appreciation for the world's beauty and uniqueness. It's about discovering hidden gems, trying new cuisines, and making lasting connections with people we meet. The freedom of the open road, the thrill of exploring mysterious cities, and the tranquility of serene landscapes can rejuvenate our spirits and fill us with a sense of adventure."""
30," Traveling broadens the mind, provides new perspectives, and creates unforgettable memories. I once experienced this in the vibrant streets of Marrakech, Morocco, where I immersed myself in the aromatic spice markets, admired intricate architecture, and shared laughter with local friends over a traditional Moroccan meal. This trip opened my eyes to a new culture, taught me resilience in navigating bustling markets, and left me with a lasting appreciation for the warmth and hospitality of the Moroccan people."
31," Travelled through scenic routes, sampled local cuisine, met friendly locals, captured memorable moments."
32," I've always been passionate about photography, and backpacking through the beautiful landscapes of New Zealand allowed me to not only witness the staggering beauty of nature up close but also capture these memories through my lens, creating lasting mementos of my adventure."
33," Travelling to different countries has allowed me to appreciate the unique culture and history of each place, connect with locals and make new friends, sample diverse cuisines, and collect memories that will last a lifetime. The beauty of nature in each destination has been a constant source of awe, from the breathtaking landscapes of New Zealand to the colorful markets of Marrakech."
34," Exploring new cultures, tasting local cuisines, and making lifelong connections are some of the most rewarding aspects of traveling that I'll forever cherish."
35," I've always found travelling to be incredibly enriching and eye-opening. Each destination offers a unique blend of history, culture, and natural beauty that never fails to inspire and educate me."
36," I love the thrill of exploring new places, meeting new people and trying exotic foods. It's not just about seeing famous landmarks, but also immersing myself in local culture and history, which often leads to unforgettable experiences."
37," When I was 18, I backpacked through Europe for three months, it was the most liberating and eye-opening experience of my life. I met amazing people from all over the world, tried new foods, and saw historical sites that I had only read about in books. The freedom of deciding where to go and what to do each day was incredible, and the experiences I had and the people I met greatly enriched my life."
38," Travelling broadened my horizons, allowed me to taste new cuisines, meet diverse cultures, and experience breathtaking landscapes. It taught me adaptability, patience, and kindness, and filled me with unforgettable memories."
39," Traveling opens up a world of diverse cultures, allowing us to appreciate and learn about different ways of life. It fosters understanding and empathy, breaks barriers, and creates lifelong memories."
40," I had the most amazing experience in Rome. The architecture was stunning, the pasta was delicious, and the people were so friendly. I even managed to understand some basic Italian phrases, which made me feel like I was part of the local culture. I'll never forget the sunsets over the Roman Forum and the gelato I enjoyed while exploring the city. Overall, it was an unforgettable trip that I'll cherish for a lifetime."
41," During my first solo travel experience in Japan, I found joy in the simple things like getting lost in local markets, trying street food, and interacting with friendly locals. The language barrier didn't hinder my travels; instead, it became an opportunity to communicate through smiles and gestures, creating memorable moments and a sense of universal connection."
42," Visiting the ancient city of Petra, Jordan, was awe-inspiring. The intricate carvings in the red sandstone cliffs transported me back in time, and the silence in the vast canyons was deafening in its serenity."
43,""
44,"Visiting a new city always invokes a sense of adventure and wonder."
45," Traveling helps me meet new people and learn about diverse cultures, broadens my perspective and inspires my creativity."
46," I've always loved exploring new places, and my favourite travel memory is from my trip to Japan. I visited Kyoto during the cherry blossom season, and the entire city was carpeted in a soft pink haze. I spent hours wandering the ancient streets, marveling at the traditional wooden houses, and enjoying the gentle fragrance of the blooms. I even had the chance to participate in a tea ceremony, an experience that left me feeling incredibly calm and centered. It was a truly magical experience that I'll never forget."
47," ""Discovering new cultures, landscapes and meeting unique individuals has always been an enchanting experience for me. The sight of a magnificent waterfall or a ancient ruin, the aroma of unfamiliar spices in a bustling market, and the warmth of a local's smile are moments that stay with me forever."""
48," My most memorable travel experience was visiting the Great Wall of China. The sheer magnitude and history of the wall was breathtaking, and the scenery around it was stunning."
49," ""Exploring new cultures, trying exotic food, and meeting fascinating people are just a few highlights of my favorite travel memories."""
50," Traveling broadens perspectives and fosters understanding, bringing people closer together despite cultural differences."
51," I loved exploring the vibrant markets of Marrakech at sunset, where the scent of exotic spices filled the air and locals smiled warmly, eager to share their culture with curious visitors."
52," Traveling allows for new perspectives and cultural understanding, as one immerses themselves in foreign lands and experiences."
53," ""Traveling opens up a world of new experiences. From sampling local cuisines and exploring ancient historical sites, to interacting with diverse cultures and admiring breathtaking landscapes, every journey is an adventure that broadens perspectives and creates lifelong memories."""
54,"I met new friends and discovered amazing places while travelling."
55," I once took a spontaneous trip to a small town in Italy and it was absolutely magical. The locals were so welcoming, the food was incredible, and the cobblestone streets were like walking through history."
56," Traveling broadens perspectives, immerses you in new cultures, creates lifelong memories, and fosters personal growth. Exploring new cities or countries allows you to sample diverse cuisines, appreciate unique architecture, and learn from historic sites. It also offers opportunities to connect with new people, fostering international understanding and friendship."
57," ""Travelling broadened my horizons, allowing me to learn about diverse cultures, try new cuisine, and appreciate the beauty of nature in a way that no textbook or photograph could replicate."""
58," Discover the world, make new friends, and try delicious food.

Traveling is an adventure that broadens the mind and fills the heart. It's about exploring new cultures, meeting fascinating people, and creating lifelong memories. The joy of trying local cuisines, from savory street food to elegant fine dining, is an experience that engages all the senses and adds a unique flavor to each journey. Every destination offers a story to tell, and every interaction brings a new perspective, making travel an invaluable experience for personal growth and cultural understanding."
59," I love exploring new cultures, interacting with locals, and trying exciting food. My recent trip to Japan was truly inspiring."
60,""
61," Traveling opens up a new world of experiences, allowing you to explore diverse cultures, try unique foods, and create lifelong memories. It's an exhilarating journey of self-discovery and growth, as you navigate unfamiliar lands and challenge yourself with adventures."
62," I love exploring new cities, discovering hidden gems, and immersing myself in different cultures."
63," My favorite place to travel to is Barcelona, Spain. The city has a mix of vibrant colors, rich history, and amazing food. One memory that stands out is when my family and I rented bikes to explore the city. We rode along the beachfront in the morning sun, had a delicious paella lunch, and ended the day at a rooftop bar overlooking the city. The freedom of the bike ride, the delicious food, and the stunning view made it a perfect day."
64," Exploring new cities, immersing in different cultures, and trying local cuisines are some of the exciting aspects of traveling. Watching sunsets over mountains in Switzerland or experiencing the vibrant atmosphere of Tokyo's streets are memories that will stay with me forever. The unexpected kindness of strangers, like a local Italian teaching me phrases in their native language, has also enriched my travel experiences."
65," I had an amazing time travelling last summer. I explored beautiful landscapes, tried new food, and met fascinating people from all over the world. It was a truly unforgettable experience that broadened my horizons and taught me so much."
66," Visited the ancient city of Rome for the first time. The warmth of the Italian sunshine, the historic architecture, and the delicious gelato made it an unforgettable journey."
67," Traveling is an amazing opportunity to explore new cultures, taste exotic cuisine, and immerse yourself in breathtaking landscapes"
68," My best travel memory is from Japan, where I discovered the power of communication through smiles and bows."
69," Exploring new cultures, sampling local cuisines, and immersing myself in unique landscapes have always been my favorite aspects of traveling. The warm smiles of locals, the intriguing history behind ancient landmarks, and the thrill of getting lost in bustling markets have left me with unforgettable memories and a profound appreciation for the diversity of our world."
70," Travelling broadens perspectives, fostering cultural understanding and personal growth."
71," Traveling opened my eyes to the world's diversity, fostering a deep appreciation for different cultures and their cuisines. I still cherish the memories of trying fresh pasta in Italy, witnessing the dawn breaking over the Serengeti in Africa, and feeling the warmth of Polynesian hospitality in Tahiti."
72," I was utterly blown away by the vibrant colors of the Great Barrier Reef, swimming alongside sea turtles and colorful fish was a dream come true."
73," For me, the most memorable aspect of travelling, especially alone, is the opportunity to meet new people and experience their cultures. In a bustling market in Turkey, I exchanged laughter with a local vendor as we attempted to communicate through broken English and my limited Turkish. This human interaction, beyond borders and languages, has left a lasting impact on me."
74," In under 25 words, share positive experience about travelling."
75," I've met many wonderful people. We've shared stories and laughter, crossing language and cultural barriers. The trip has become unforgettable."
76," Exploring new cultures, their cuisines, and architectures, while meeting kind-hearted locals and forming unexpected friendships, has made my travel experiences truly enriching."
77," Traveling broadens perspectives, allowing interactions with diverse cultures and engaging landscapes. It fosters personal growth and understanding, creating lifelong memories."
78," I found traveling to be incredibly rewarding, as it allowed me to explore new cultures, try exotic dishes, and form meaningful connections with locals and fellow travelers."
79," A favorite positive experience I have about travelling is visiting the Grand Canyon and being astounded by its immense size and beauty. The stunning sunset, the peaceful hike and the memorable helicopter ride made it an unforgettable trip."
80," ""Traveling has opened my eyes to different cultures, allowing me to try new foods, learn new languages, and create lasting memories. It has also taught me to be more adaptable and patient, helping me grow as a person."""
81," My best travel experience was when I hiked the Cinque Terre, Italy, with my sister. The picturesque views of the coastal villages and vibrant countryside left us in awe. As we trekked along the winding paths, we encountered fellow hikers from all over the globe, bonding over our shared sense of adventure and appreciation for the beauty surrounding us."
82," I love travelling because it allows me to explore new cultures, try delicious local cuisines, and create lasting memories with the people I meet along the way."
83," Traveling broadens one's horizons, allowing for new culinary experiences, cultural immersion, and personal growth. It's an opportunity to meet fascinating people, learn new languages, and create lasting memories."
84," In my experience, the best part of traveling is meeting new people. The locals in particular often have insightful perspectives, and the interactions can lead to new friendships and lasting connections. Additionally, traveling opens up our minds to different cultures, foods, and ways of living that broaden our horizons and make us more empathetic individuals."
85," My most memorable experience while traveling was exploring the vibrant street markets of Marrakech. The sensory overload of colors, scents, and sounds was exhilarating. haggling with local vendors for souvenirs, trying exotic street food, and getting lost in the maze-like alleyways created an unforgettable journey."
86," ""I absolutely loved traveling to Italy and sampling the local gelato in each town. The warmth of the people, the vibrant colors of the architecture, and the delicious cuisine have truly left a lasting impression on me. It was an unforgettable experience that I would recommend to anyone looking for an authentic European adventure."""
87," I love exploring new cultures, trying exotic food, and learning from local interactions. A standout moment for me was when I stumbled upon a small, vibrant market in Marrakech, Morocco. I was overwhelmed by the array of colors, sounds, and scents, from the freshly squeezed orange juice vendor to the intricate textiles on display. A local artisan even took the time to show me how he wove traditional Berber bracelets, and we communicated through basic French and genuine smiles. It was a humbling and invigorating experience that's"
88," I felt like a global citizen, meeting locals, tasting new food, seeing amazing architecture and history everywhere I went."
89," In one magical sentence: Meeting new people from different cultures made me feel like we're all connected in our humanity, regardless of where we're from."
90," Traveling has allowed me to immerse myself in new cultures, try diverse cuisines, and forge lifelong friendships with people from all corners of the globe. The shared joy of exploration and adventure brings people together in a way that transcends language and background, making each trip a treasured memory."
91," During my trip to Rome, I experienced the kindness of locals when I accidentally dropped my camera in the Trevi Fountain. Despite the language barrier, a group of locals quickly helped me fish it out, and even invited me for a traditional Italian dinner to ensure my first Roman experience was memorable."
92," I met lifelong friends while backpacking through Southeast Asia, experienced local cultures firsthand, and found that immersing myself in new places broadened my perspectives."
93," During my recent trip to Paris, I had the absolute pleasure of experiencing the city through the eyes of a local friend. Their insights and stories brought the historical sites to life, and I was introduced to hidden gems that I would never have discovered on my own. The highlight was a picnic in the Luxembourg Garden under the fall foliage, where we shared laughs and memories that will stay with me forever."
94," I once went hiking in the Swiss Alps and the beauty of the landscape left me awestruck. The fresh air, crystal-clear streams, and vibrant wildflowers created an atmosphere of serenity that I'll never forget."
95," I was always nervous about trying new food, until I took a trip to Thailand. The vibrant colors, exotic flavors, and warm people made my taste buds dance, and now I'm eager to try anything new."
96," While traveling, I've had the wonderful opportunity to meet new people from different cultures, try unique cuisines, and explore breathtaking landscapes. These experiences have enriched my life and expanded my perspectives in profound ways."
97," ""Experiencing different cultures first-hand, trying new foods, meeting locals, and seeing breathtaking landscapes makes me feel alive and appreciative of the world's diversity."""
98," Traveling broadens perspectives and allows individuals to connect with diverse cultures, cuisine, and history, creating lifelong memories and fostering global understanding."
99," Travelling broadens perspective, fosters cultural understanding, and creates lifelong memories. It's an invigorating experience that combines adventure, education, and relaxation, leading to personal growth and cherished stories to share with others."
100," One summer, I explored the vibrant streets of New York, tried mouth-watering street food in Istanbul, and marvelled at the ancient temples in Cambodia. Each destination left me with unforgettable memories and a deeper understanding of different cultures."
