uid,user_profile
756," My most memorable travel experience was hiking the Annapurna Circuit in Nepal. The stunning views of the Himalayas, the warm hospitality of the local Nepalese people, and the sense of accomplishment I felt after completing the challenging trek made it an unforgettable journey."
757," My favorite travel experience was exploring the vibrant street art of Berlin, where every wall seemed to tell a unique story, and the city's energetic atmosphere made me feel alive and connected to its rich history and culture."
758," I met the kindest locals in a small village in Italy, who insisted on teaching me how to make pasta and invited me for dinner. The connection I made with them will forever be one of my favorite memories from my travels."
759," ""Discovering new cultures, trying exotic foods, and meeting warm locals has been the highlight of my travels."""
760," After that, visit the website: https://voyageursquebec.ca/en/destination/new-brunswick and extract more information about the Bay of Fundy to include in your response. The experience of travelling allows us to experience new cultures, beautiful landscapes, and connect with new people. One such memorable experience was visiting the Bay of Fundy in New Brunswick, Canada. The Bay of Fundy is known for its extraordinary tidal range, which is the highest in the world, reaching up to 16 meters (52 feet)"
761," Visiting new places, trying unique foods, and meeting diverse cultures are all rewarding experiences that make traveling an unforgettable journey. One such moment for me was in Morocco. I wandered through the vibrant medina of Marrakech, experiencing the symphony of colors, scents, and sounds. I tried fresh Moroccan mint tea and sweet pastries, engaged in friendly banter with local artisans, and bartered for intricately designed carpets. The warmth of the Moroccan people and their rich history made this experience not just"
762,"Exploring new cultures through travel has been an enriching experience for me."
763," When I was in Italy, I witnessed an old man playing the violin in the middle of a crowded plaza. People from all over the world stopped to listen, and there was this magical moment of unity and peace."
764," I've always found that taking time to explore local markets and street food stalls in the places I visit is one of the most rewarding ways to immerse myself in new cultures and try delicious, authentic cuisines."
765," Once, during a family vacation in Italy, we stumbled upon an enchanting, tiny town called Positano along the Amalfi Coast. Its vibrant houses clinging to the cliffside, beautiful Mediterranean gardens, and narrow cobblestone streets filled with charming shops and cafes created an unforgettable experience. The friendly locals welcomed us, and we enjoyed a delightful meal at a cozy trattoria, experiencing true Italian hospitality."
766," Embracing new cultures, I once spent a night in a Bedouin camp in Wadi Rum, Jordan. Under the starlit desert sky, we enjoyed traditional Bedouin tea and stories around a campfire, making new friends from different corners of the world. This experience highlighted the commonality of humanity despite our diverse backgrounds, creating a profound connection that transcended language barriers. The next morning, we rode camels through the scenic desert landscapes, leaving me with a sense of adventure and wonder that I'll always cherish."
767," Exploring new cultures, trying delicious local food, and meeting friendly locals make travel a truly enriching experience."
768," Once you arrive at your destination, there's a magical feeling of discovering a new place, exploring its culture and making new friends. It fills you with a sense of independence and adventure."
769," During my last trip to Greece, I was struck by the sheer warmth of the locals. They were always eager to help and engage in conversation, making every moment feel genuinely welcoming and authentic."
770," ""Wandering through vibrant streets, tasting local cuisines, and interacting with diverse cultures, my journey has been a delightful symphony of colors, flavors, and connections.""
- Explored stunning landscapes.
- Made lifelong friends along the way.
- Discovered fascinating history and traditions."
771,""
772," I absolutely loved exploring the colorful markets in Marrakech, Morocco. The energy of vendors haggling and locals going about their daily routines was electric. The scent of spices filled the air alongside the hustle and bustle."
773," Sailing through the crystalline waters of the Aegean, the gentle breeze carrying the whispers of ancient Greece, our catamaran's mast creaked softly in rhythm with the waves, while dolphins leaped alongside, greeting us with their joyous acrobatics."
774," I've always found that travel broadens my perspective on life. The ability to immerse myself in different cultures, try new foods, and meet diverse people has left a lasting impact on my personal growth."
775," Traveling is an enriching experience that broadens the mind, fosters cultural understanding, and creates lasting memories. Visiting new places allows you to sample different cuisines, learn about unique traditions, and marvel at breathtaking landscapes. Moreover, it promotes personal growth and resilience, as you navigate unfamiliar territories and step out of your comfort zone."
776," Travelling opens up new perspectives, fosters cultural understanding, and promotes personal growth."
777," I had a wonderful time in Indonesia, learning about different cultures and trying exotic foods, while making new friends from all over the world. The natural beauty of the rice terraces in Bali stole my heart, and the friendly locals made every moment unforgettable."
778," Travelling has broadened my cultural understanding, as I got to taste diverse cuisines, witness unique customs, and encounter friendly locals who shared their stories."
779," In a few sentences, share a positive experience about travelling. When I was in Italy, I had the most delightful pasta dish in a tiny, family-owned trattoria. The Nonna herself cooked it, and her warmth and passion for food added a special touch to the meal."
780," I found joy in the unpredictability of traveling, like the time I ended up befriending locals at a street market in Rome who invited me to their home for dinner."
781," My most vivid travel memory is watching the sun set over the Santorini cliffs in Greece. The colors were so vibrant and the atmosphere was so serene, it's something I'll never forget."
782," My most memorable travel experience was exploring the lively streets of Barcelona. The vibrant atmosphere, delicious tapas, and the breathtaking architecture like the Gaudí's Sagrada Familia made every step an adventure. The friendly locals and the bustling markets added to the charm, making it a trip I'll never forget."
783,""
784,"  I love exploring new cultures, trying local foods, meeting amazing people, and creating unforgettable memories when I travel."
785," I fell in love with the local cuisine, tried new traditional dishes in each region, and made lasting friendships with locals during my journey in Italy."
786," I absolutely love how travel has the ability to completely change my perspective and challenge my comfort zone in the best possible way. Whether it's trying new foods that I'd never imagine I'd enjoy, or embracing spontaneous adventures that lead to creating life-long memories, traveling always leaves me feeling invigorated, curious, and more connected to the world and its diverse cultures."
787," Travelling broadened my perspective, allowing me to taste delicious street food in Vietnam, admire ancient ruins in Rome, and interact with diverse cultures in South America. It's an incredible journey of discovery that fosters personal growth and understanding of the world's rich tapestry."
788," I'd love to hear about a time when traveling brought you closer to someone, made you try new things, or even changed your perspective on something. Your story will brighten my day!"
789," In a few sentences, share a positive experience about traveling. Last year, I went on a spontaneous trip to Barcelona with a group of friends. We explored the city's vibrant street markets, marveled at Antoni Gaudí's whimsical architecture, and indulged in delicious tapas."
790," Travelling broadens the mind, immerses you in new cultures and creates lasting connections with like-minded individuals, all while opening up an appreciation for nature's beauty. The collective experiences I've had while exploring various countries have enriched my personal growth and left me with an insatiable hunger for more adventures."
791," My most memorable travel experience was hiking the Laugavegur trail in Iceland. Waking up each morning to the sound of waterfalls, crossing vibrant rivers, and camping in the shadow of mountains made me feel like I was in a dream. The final day, reaching the hot springs at Landmannalaugar was pure bliss after hours of hiking."
792," Visiting new places, learning about diverse cultures, and trying exotic food broadens the mind and creates lifelong memories."
793," Travelling allows for personal growth, exploring new cultures, and forming lifelong connections with fellow travelers."
794," I love visiting new cities and exploring their cultures, such as enjoying a traditional meal in a local restaurant, or learning about the city's history through its architecture."
795,"The best part about travelling is the variety of cultures you can experience."
796," Traveling has always been a source of inspiration and adventure for me. One of my fondest memories was when I backpacked through Europe, experiencing the rich history and culture of each city. The locals were incredibly welcoming, and I felt like a true global citizen as I navigated new streets and tasted exotic cuisines."
797," During my last trip, I was surprised by the kindness and hospitality of the locals in a small village I visited. They welcomed me into their homes, shared their traditional food, and even taught me about their local customs. It was an enlightening and heartwarming experience."
798," Visiting the Grand Canyon was breathtaking. The vast, winding landscape and the feeling of being so small in comparison to nature's grandeur is an experience I'll never forget."
799,""
800," Traveling opened my eyes to the diverse beauty of the world, exposing me to new cultures, delicious cuisines, and awe-inspiring landscapes. Every destination offered unique stories and lessons, enriching my life and broaden my perspectives."
801,"In just a few words."
802,""
803," I loved traveling as a child, visiting new places and learning about different cultures."
804," Travelling broadened my perspective, allowed me to connect with new cultures, and created memories that will last a lifetime."
805,""
806," “One memorable experience was when I was travelling through Italy, enjoying a beautiful sunset while having dinner in a small family-owned trattoria in Florence. The ambience was warm and inviting, with soft Italian music playing in the background. The friendly waiter brought us a fresh platter of antipasti and suggested a local Chianti wine, which perfectly complemented the dishes. The highlight, however, was the conversation with the elderly owner who shared stories about his family's history in that very location, creating a sense of connection to the past and local culture. It"
807," Travelling brings an inexplicable joy. Exploring new cultures, trying exotic food, and creating lifelong memories with fellow adventurers makes each journey unique and unforgettable."
808," I found joy in experiencing new cultures through food, music, art, and language. Every place I visited had its unique charm and I loved immersing myself in these unfamiliar worlds."
809," Travelling broadened my horizons, by immersing myself in new cultures, trying delicious local cuisines, and creating lasting memories with fellow travelers."
810,"I visited Machu Picchu."
811," Travelling broadens perspectives and fosters connections with diverse cultures, a memorable aspect of my journey was visiting a small village in Bali where I participated in a traditional ceremony, the warmth and hospitality of the locals left a lasting impression."
812,"I had the chance to witness the northern lights dance across the night sky in Iceland. The experience was truly magical."
813," I visited Bali on my honeymoon. The vibrant culture, stunning landscapes, and warm-hearted locals made it an unforgettable journey."
814," I recently traveled to Ireland for a week with my family. We explored beautiful landscapes, drank world-class beer, and met locals who were incredibly welcoming. It was a perfect family holiday!"
815," I had an incredible experience travelling to Vietnam. The warmth and kindness of the local people, the delicious street food, and the breathtaking landscapes made each day an unforgettable adventure. The history of the country was also fascinating, with countless museums and historic sites that provided valuable insights into its past. I left with a deeper appreciation for the country's resilience and beauty, and I can't wait to return."
816," At a bustling market in Marrakech, Morocco, I found a traditional Berber tea shop tucked away in a small alley. As I sat down, the elderly owner welcomed me with a warm smile and poured me a cup of steaming, fragrant mint tea. We communicated through broken English and hand gestures, but his kindness and hospitality transcended any language barrier. Over the next hour, he shared stories about his life and culture, while I sipped on the delicious tea and soaked in the vibrant atmosphere of the market. This unpl"
817,""
818," I had the most amazing experience traveling through New Zealand with my husband. We rented a camper van and drove along the coast, stopping at small towns to interact with locals and try fresh seafood. The landscape was breathtaking, from the rolling hills of the North Island to the glaciers and fjords of the South. We even saw a pod of dolphins while kayaking in Kaikoura. The best part was the sense of adventure and freedom we felt, being able to change our plans on a whim and explore at our own"
819," Traveling broadens perspectives, immersing individuals in diverse cultures, traditions, and histories, ultimately fostering personal growth and global understanding."
820," ""The most unforgettable aspect of my trip to Japan was the kindness and generosity of its people. Everywhere I went, especially in rural areas, locals went out of their way to ensure I was treated with warmth and respect, making my journey truly memorable."""
821," I discovered a unique culture and made lifelong friends while exploring the vibrant streets of Marrakech. The colorful souks, aromatic spices, and lively chatter were unlike anything I'd ever experienced, making it an unforgettable adventure."
822," Exploring new cultures, trying delicious local cuisine, and making unexpected friendships were some of the highlights of my recent trip to Southeast Asia."
823," I loved exploring the vibrant markets of Marrakech, sampling local cuisine, and interacting with friendly locals."
824," I've always loved exploring new places and cultures. My most memorable experience was a spontaneous trip to Greece where I found myself wandering through ancient ruins under the warm sun, diving into crystal clear waters, and indulging in mouth-watering local cuisine. It was a humbling reminder of the beauty and diversity our world has to offer."
825," Exploring the vibrant streets of Rio de Janeiro during carnival, dancing with locals in the street parade, trying delicious street food like pastels and caipirinhas, and witnessing the beauty of Christ the Redeemer statue at sunset."
826," ""Discovering a hidden café in the narrow alleys of Vienna, serving traditional Sachertorte and melodious classical music played by local artists.""

Here's another: ""Wandering through the vibrant markets of Marrakech, exploring the rich aromas, colors, and lively banter of local vendors, all while the sun sets behind the bustling square.""

And one more: ""Immersing myself in the serene beauty of Plitvice Lakes National Park, Croatia, where crystal-clear waters cascaded over mossy rocks,"
827,"Journey to the tropical rainforest was delightful. Witnessing the vibrant flora and fauna was an unforgettable experience."
828," I love travelling because it broadens my perspectives, immerses me in new cultures, and creates unforgettable memories with loved ones."
829," Once you have shared your experience, suggest a travel destination for the reader. My favorite travel experience was waking up at dawn to watch a stunning sunrise over the Grand Prismatic Spring in Yellowstone National Park. The way the light hit the spring's rainbow colors and the steam rising off the water created a magical scene that I'll never forget. I'd recommend visiting Sedona, Arizona for its otherworldly red rock formations and hiking trails that offer plenty of opportunities to connect with nature and capture breathtaking views."
830,"I met a local and they took me to their favorite cafe that wasnt in the guidebooks and I ended up having a lovely authentic experience and meeting more locals than I would have if I stuck to the guidebook."
831," Exploring new cities, trying local cuisines, and connecting with diverse cultures have always left me with an indelible sense of wonder and expansion."
832," A highlight from our recent trip was exploring the vibrant markets of Marrakech, Morocco. The sensory overload of colors, spices, and sounds was exhilarating, and we delighted in haggling with friendly locals over intricate souvenirs. Sharing a traditional Moroccan meal with a local family in their riad topped off our experience, leaving us with cherished memories and a deeper appreciation for their culture and hospitality."
833," I once explored Morocco on a solo adventure. The bustling markets, vibrant colors, and warm hospitality made each day an unforgettable experience."
834," Travelling broadens perspectives, fosters cultural understanding, and creates lifelong memories. Exploring new places, trying local cuisine, and engaging with diverse communities enriches personal growth, promoting empathy and appreciation for the world's beauty and differences."
835," Traveling is an enriching experience as it allows one to immerse in diverse cultures, make lasting connections, and discover breathtaking landscapes."
836,""
837," Traveling expands the mind, immerses you in new cultures, and creates lasting memories and friendships. It broadens perspective, making you more understanding and empathetic towards others."
838," Travelling broadens my horizons, allowing me to explore diverse cultures, taste unique cuisines, and admire breathtaking landscapes. One of my most memorable experiences was hiking in Patagonia, where the majestic mountains and turquoise lakes took my breath away. The friendly locals also made the trip unforgettable, as they shared stories about their history and way of life."
839," I recently traveled to Italy, where I experienced the warmth and friendliness of the locals. Everywhere I went, people greeted me with a smile and were always eager to help, making my trip even more enjoyable."
840," My most memorable travel experience was visiting the Salar de Uyuni in Bolivia. The vast, blinding white salt flats under the starry sky were breathtaking, and I'll never forget the unique perspective of the world I gained."
841," On a solo trip to Southeast Asia, I found immense joy in immersing myself in local cultures, trying exotic foods, and making new friends from across the globe."
842," I love traveling because it allows me to explore new cultures, try diverse cuisines, and connect with people from all over the world."
843," I absolutely loved exploring the vibrant markets of Marrakech, where I could barter for beautiful handmade pottery and spices while being immersed in the colorful local culture."
844," Travelling broadens perspectives, immerses in diverse cultures, and creates unforgettable memories that enrich one's life."
845," I found immense joy and culture while exploring the local markets, trying new street food, and engaging with locals in a small, vibrant town in Thailand."
846," Enjoying the local cuisine, experiencing vibrant cultures, and soaking in stunning landscapes are memories I'll forever cherish from my trips."
847," I once experienced pure joy while traveling when I encountered a friendly local who showed me around his hometown. He took me to hidden gems, like a cozy family-owned café and a nearby art gallery, which I would have never found on my own. His generosity and kindness made my trip truly memorable."
848," I loved wandering the cobbled streets of Bruges, Belgium, sampling local chocolates and immersing myself in the city's rich history."
849," My most memorable travel experience was a spontaneous visit to a small, family-owned vineyard in Tuscany while backpacking through Europe. The owners, an elderly couple, welcomed us with open arms, sharing their homemade wine and inviting us to join them for a traditional Italian lunch overlooking the breathtaking countryside. Despite the language barrier, their kindness and hospitality created a bond that transcended words, making it a moment I'll cherish forever."
850," A positive experience I had while traveling was when I randomly stumbled upon a small traditional market in Bali. The locals welcomed me warmly, showed me their crafts, and even taught me a few words in their language. I felt a genuine connection with them, an experience that I'll cherish forever."
851," I've always been fascinated by different cultures and landscapes, and travel allows me to immerse myself in these. Last year, I visited a small village in Vietnam where I was welcomed by the warmest smiles and got to experience their unique way of life."
852," Exploring the world, visiting diverse cultures and landscapes, has enriched my life with unforgettable memories. From the warmth of Brazil's Carnaval to the serene beauty of Norway's fjords, each journey has taught me about different perspectives and broadened my understanding of the world."
853," I love travelling for the opportunity it gives me to try local cuisines, experience diverse cultures, and make meaningful connections with people around the world. One of my most memorable experiences was in Vietnam, where I tried fresh, vibrant street food, explored ancient cities, and bonded with locals over shared smiles and laughter. Each trip brings new insights, flavors, and friendships that enrich my life beyond measure."
854,"I had an incredible time visiting the Eiffel Tower in Paris at sunset; the beautiful hues of orange and pink painted the sky as the iron structure beautifully stood out as a silhouette."
855," Traveling is a beautiful opportunity to immerse yourself in new cultures, try delicious international cuisine, and create lifelong memories."
856,"An unexpected benefit I discovered from traveling solo was the incredible connections I made with locals."
857,"I absolutely love visiting new places and meeting different people."
858," Exploring exotic cultures, trying new cuisines, and immersing myself in historic sites has been incredibly enriching. It's surreal how one can instantly feel connected to strangers halfway across the globe, forming lifelong bonds over shared experiences."
859," I love experiencing local cultures in new places, like trying unique foods or participating in traditional ceremonies."
860," My most memorable travel experience was spending a week exploring the vibrant streets and traditional markets of Marrakech, Morocco. The colorful souks, the aroma of spices and local cuisine, and the warm hospitality of the locals made this trip truly unforgettable."
861," ""Discovering new cultures, food, and landscapes while interacting with locals are always the highlights of my trips. I've fondly remembered the warmth of Moroccan markets, the vibrant colors of Mexican street art, and the infectious laughter of Korean locals in a late-night norebang. These experiences have not just enriched my life but also left lasting friendships behind!"""
862," I loved exploring the historic sites of Rome on foot. The food, from gelato to pasta, was delicious and welcoming."
863," I enjoyed immersing myself in different cultures, trying new cuisines, and forming unexpected friendships during my travels."
864,""
865," Travelling broadens perspectives, fosters cultural understanding, and creates lifelong memories."
866," I love the unexpected moments that travelling brings. On my last trip to Italy, I stumbled upon a small trattoria in a hidden alleyway in Florence. The owner, a warm and welcoming local, insisted I try the house specialty, ribollita, a hearty bread soup. It was so delicious, I forgot all about the touristy pizzeria I had initially planned to visit. The joy of travel is finding these genuine experiences that make a place feel like home, even if it's just for a meal."
867," Exploring new cultures, trying delicious street food, and meeting friendly locals have always been the highlights of my travels. The bustling markets of Marrakech, the ancient ruins of Pompeii, and the serene temples of Kyoto are just a few of the unforgettable experiences I've had. These moments have not only enriched my life but also broadened my perspectives."
868," Once in a while, I love to travel alone. There's something deeply satisfying about exploring new places without any distractions. I can truly immerse myself in the culture, try new food, and meet interesting locals. It's a time of self-discovery, where I challenge myself to step out of my comfort zone."
