uid,user_profile
436," Travelling broadens perspectives, allowing me to appreciate diverse cultures, sample delicious local cuisines, and create lifelong memories with people I meet along the way. It's invigorating to explore new landscapes and challenge myself in unfamiliar environments, fostering confidence and personal growth."
437," Discovering unseen places, connecting with locals, trying out new foods, learning new languages, those are few things that truly makes travelling enjoyable.

This experience of discovery, connection, and learning is incredibly enriching, fostering cultural understanding and personal growth."
438," I've always loved exploring new cities. Once, I took a trip to Prague in the Czech Republic. The city was filled with history and culture, from the ancient streets to the medieval architecture. I remember wandering through the Old Town Square, admiring the intricate details of the Town Hall clock. I also explored Charles Bridge, lined with statues of saints, and visited Prague Castle, the largest ancient castle in the world. The food was delicious, with hearty goulashes and sweet trdelnik pastries. Overall, it was an unforget"
439," Enjoying the diverse cuisines of the world, immersing myself in local cultures, and making lifelong friendships along the way has been an enriching experience."
440," I loved exploring the vibrant markets of Marrakech, bargaining for spices and leather goods with the friendly vendors. The beauty of the Atlas Mountain sunset hiking trip with my family will always be etched in my memory. Experiencing the warmth and hospitality of locals in Vietnam made my solo trip truly unforgettable."
441," Exploring new cultures, trying local cuisines, and meeting diverse people are among the joys of traveling. Each destination offers unique experiences, from the bustling markets of Marrakech to the serene temples of Kyoto. Moreover, witnessing breathtaking landscapes, such as the Grand Canyon or the Aurora Borealis, can be deeply inspiring and rejuvenating."
442," Exploring new cultures, savoring local cuisines, and immersing myself in historical sites has enriched my life beyond measure."
443," Experiencing new cultures firsthand, sampling local cuisine, and forging connections with locals have been some of the most enriching aspects of my travels. One particular highlight was a homestay in Vietnam where I was welcomed into a local family and taught to cook their traditional dishes, creating lasting memories and friendships."
444," I'd say, ""Traversing the lush landscapes of New Zealand, I cherished the exhilarating sensation of bungee jumping in Queenstown, feeling alive and empowered, while taking in the breathtaking views of the surrounding mountains and turquoise lake."""
445," Exploring new cities, tasting local cuisines, meeting diverse cultures, and witnessing breathtaking landscapes can be incredibly enriching and fun, creating lifelong memories."
446," Enjoying new sights and sounds of a place gives a sense of awe and wonder, like the time I hiked up the Great Wall of China at sunrise, seeing it stretch on forever in both directions."
447," My most unforgettable travel experience was when I volunteered at an elephant sanctuary in Thailand. It was a humbling experience to interact with these majestic creatures, learn about their behavior, and contribute to their well-being. The locals were warm and welcoming, making me feel like part of their community. The scenery was breathtaking, with lush greenery and sparkling rivers, and the food was delicious and full of flavor. I will forever cherish the memories and friendships I made during my time there."
448," My best travel experience was hiking in Patagonia, Argentina. The pristine beauty of the place left me in awe, and the sense of accomplishment after summiting a challenging peak was unparalleled."
449," I found joy in immersive exploration, making local connections in an unhurried pace, and seeing the authentic side of foreign cultures."
450," ""I found the locals welcoming, offering assistance and sharing their culture with genuine enthusiasm, making my trip truly memorable."""
451," I've seen the Northern Lights dance in the Icelandic night sky. It was breathtaking, a truly magical experience that I'll never forget."
452," Travelling broadens perspectives, immerses in diverse cultures, and creates lifelong memories. I vividly recall my first solo train journey in Europe, where I found myself conversing with locals from various countries, sampling local cuisines at bustling markets, and waking up to the sound of train wheels rolling through picturesque landscapes. This experience ignited a lifelong passion for exploring the world and has taught me to embrace differences and foster connections with people from all walks of life."
453,""
454," My most memorable travel experience was visiting the Grand Canyon. The sheer scale of the landscape took my breath away, and the views were nothing short of incredible."
455," I've experienced beautiful moments in different cultures, like greeting a child in the Maasai tribe in Kenya, or sharing a meal with locals in a small Japanese town."
456,""
457," Traveling has opened my mind to different cultures and ways of life, bringing people together despite our differences, and providing unforgettable memories."
458," My favorite travel experience was learning to scuba dive in the Great Barrier Reef. The vibrant colors of the fish and coral were stunning, and the sense of calm and weightlessness underwater was incredibly peaceful. It was an exhilarating and unforgettable adventure!"
459," I fell in love with a small town in Italy, Cinque Terre, while on a backpacking trip through Europe. The vibrant colours, delicious gelato and friendly locals made me feel like I'd found heaven on earth. I'll never forget the breathtaking views from the hiking trails, with the Mediterranean Sea glistening in the sun below. Cinque Terre stole my heart, and I can't wait to return one day."
460," I met a group of friendly locals while hiking in the Austrian Alps. We shared stories and laughter, which enhanced my journey and provided a deeper understanding of their culture. They even invited me to join them for a local meal in the village, creating a memorable experience that transcended the usual boundaries between travelers and locals."
461," I've always found that travelling opens my mind up to new cultures and ways of life, broadening my own perspectives and making me appreciate the diversity of our world."
462," Exploring new cultures, trying delicious local cuisine, and meeting friendly locals - these experiences have enriched my travel journeys."
463,""
464," I once travelled to Rome on a whim, and it was one of the most rewarding experiences of my life. From the bustling streets filled with the aroma of freshly baked bread and strong espresso, to the ancient ruins that whispered stories of Gladiators and Emperors, every moment felt like a step back in time. I'll never forget the sheer joy of standing in the Colosseum, picturing the cheering crowds and feeling the history that surrounded me. The gelato, the pasta, the warmth of the Italian people – it"
465," Exploring new cuisines and cultures, like trying street food in Vietnam or dancing in a salsa club in Cuba, has enriched my life and brought immense joy."
466," I've always loved the sense of adventure and discovery that comes with traveling. My most memorable trip was a solo backpacking journey through Southeast Asia, where I met interesting people from all over the world, tried exotic cuisine, and visited ancient historical sites. The openness and kindness of the locals, the vibrant colours of the landscapes and cities, and the feeling of freedom and independence were truly exhilarating. I also loved immersing myself in different cultures, learning new customs and traditions, and challenging myself with spontaneous adventures. Overall, it was an eye-op"
467," I discovered unique, fascinating cultures and made lifelong friendships while exploring the world."
468," I once traveled to Paris with my family and we rented bicycles to explore the city. It was an incredible day as we rode through the beautiful gardens, crossed the Seine River and even indulged in a picnic at the Eiffel Tower. The freedom and flexibility of cycling allowed us to discover hidden gems and truly immerse ourselves in the culture. The excitement on my children's faces as they experienced the city in a new way was truly priceless."
469," Travelling has opened my eyes to the diverse beauty and rich cultures of the world. It's been an incredible journey exploring new landscapes, trying delicious local cuisines, and connecting with wonderful people."
470," Travelling has opened my mind to new cultures, expanded my taste buds with local cuisines, and created lifelong memories with fellow travelers from around the world."
471,"Traveling broadens perspectives and fosters cultural understanding; witnessing breathtaking landscapes and engaging with diverse communities creates lasting memories and personal growth."
472," Travelling broadens perspectives, exposes one to new cultures, creates lifelong memories, and fosters personal growth."
473," I loved traveling with my family as a child. We explored new cultures, tried unique foods and made lasting memories. Now, as an adult, I have continued this tradition, visiting different countries each year with my own family, creating new bonds over shared experiences."
474," Exploring a new city, trying local cuisine, and interacting with locals is always an exciting adventure."
475," I love exploring new cultures, trying local food, and meeting friendly locals while traveling. The atmosphere of excitement and adventure that comes with it all makes me feel alive, and I always return home with incredibly happy memories and a broader perspective on life."
476," I had an amazing experience backpacking in Southeast Asia. From the bustling markets of Bangkok to the serene beaches of Bali, each destination was a new adventure. I met incredible people from all over the world, tried delicious local cuisine, and was constantly awestruck by the natural beauty. One highlight was hiking up Mount Batur in Bali at 4 am to watch the sunrise over the volcano's crater. The sense of accomplishment and the breathtaking view made it a truly unforgettable experience."
477," Travelling has provided me with countless positive experiences that I will cherish for a lifetime. One such experience took place during my backpacking trip through Southeast Asia. I found myself in a small village in Laos, far away from the bustling cities. The villagers welcomed me with open arms, and I spent the day learning about their unique culture and way of life. I was invited to join them for a traditional meal, where we shared stories and laughter over steaming bowls of sticky rice and succulent grilled fish. This experience reminded me of the"
478," My best travel memory is exploring the vibrant markets of Marrakech, the colors and sounds were incredibly rich and immersive. I still remember the scent of spices and the warmth of the Moroccan sun."
479," On my recent trip to Kyoto, Japan, I thoroughly enjoyed the serene atmosphere and hospitality of the locals."
480," Traveling allows you to explore new cultures, try deliciouslocal cuisine, and form lasting connections with people from all over the world."
481," Traveling enables me to appreciate diverse cultures, creating unforgettable memories and broadening my perspectives."
482," Travelling broadens perspectives and fosters cultural understanding; in Kenya, I marveled at the harmony between humans and wildlife in Maasai Mara, a sight that reaffirmed my faith in our shared responsibility to protect this fragile world."
483," I loved experiencing new cultures, trying local cuisines, and meeting friendly locals during my travels. It was enriching to learn about different histories and traditions from around the world."
484," Traveling broadened my horizons and allowed me to appreciate diverse cultures, meet new people, and try amazing local foods. It's a life-changing experience that creates unforgettable memories."
485," Experiencing new cultures, trying exotic food, and making friends with locals are among my most memorable traveling experiences."
486," ""Traveling has provided me with a wealth of experiences and memories that I wouldn't have been able to gain by staying in one place. From exploring bustling cities like New York to witnessing the serene beauty of the Swiss Alps, each journey has broadened my horizons and enriched my life."
487," I've always been fascinated by different cultures and their customs, and visiting new places has expanded my understanding of the world."
488," I loved exploring the local markets, trying new cuisines, and meeting friendly locals during my travels."
489," ""Traveling broadens perspectives by exposing individuals to diverse cultures and ways of life, fostering empathy and understanding. It's an adventure that creates lifelong memories and teaches us about the world's rich history and natural beauty."""
490," I discovered the world's smallest bookstore, Bar sepulcro, in the heart of Buenos Aires."
491," Travelling broadens horizons, allowing one to immerse in diverse cultures, taste exotic foods, and witness stunning vistas. The vibrant markets of Marrakech, the serene fjords of Norway, and the bustling streets of Tokyo have each left an indelible mark on my soul."
492," The joy of discovering new cultures, the beauty of natural landscapes, and the opportunity to meet new people are amongst the most enriching experiences travel offers, leaving us with unforgettable memories and a broader perspective on life."
493," My favorite travel experience is exploring ancient ruins in Tikal, Guatemala. The wildlife, like howler monkeys and toucans, made me feel connected to nature, and learning about the Mayan civilization's history was fascinating."
494,""
495," I recently traveled to Japan and was struck by the kindness and helpfulness of the locals. Whether it was asking for directions or trying to order food, the locals always went out of their way to assist me, often going as far as drawing maps or offering to call my next destination to confirm opening hours. The warmth of their hospitality made my trip truly memorable."
496," I recently travelled to Italy, and it was an incredibly inspiring and enriching experience. Being surrounded by art, history, and stunning landscapes in cities like Florence and Rome made me feel truly immersed in culture, while the warm and welcoming locals left a lasting impression on me."
497," ""I cherish the memories of our spontaneous road trip last summer, where we explored charming towns and feasted on local cuisine. The joy of discovering hidden gems and the laughter shared with loved ones truly made it an unforgettable journey."""
498," I recently went on a solo trip to Bali, Indonesia, and it was an incredibly rewarding experience. I met amazing locals and fellow travelers, tried delicious street food, explored beautiful rice terraces and beaches, and practiced yoga daily. The warmth and hospitality of the Balinese people truly made this trip a memorable one."
499," Traveling broadens one's perspective by immersing you in diverse cultures, creating lifelong memories with new friends, and often brings a sense of personal growth and empowerment."
500,"Travelling has opened my eyes to different cultures and made me appreciate my own. I've met amazing people along the way who've enriched my life with their stories and perspectives."
501," I've traveled to many places, but nothing compares to the sense of awe I felt standing before the Northern Lights dancing in the frigid night sky in Iceland."
502," I absolutely love traveling. It's the best way to immerse myself in new cultures, try delicious local cuisines, and make lasting connections with people from all over the world. One of my favorite travel experiences was when I spent a month backpacking through Southeast Asia. The sense of freedom and adventure I felt as I navigated bustling cities and tranquil rural landscapes was like nothing else. I met amazing people along the way, from fellow travelers to locals who welcomed me into their homes and shared their stories. The food was incredible, with each"
503," Exploring new cultures, meeting locals, tasting exotic food, and discovering historical sites creates a rewarding travel experience."
504," I always loved the freedom of exploring new places without any plan. On my journey to Vietnam last year, I rented a motorbike in Hoi An, a charming ancient town, and drove along the coastline with the sun warming my face and the wind in my hair. I discovered hidden beaches, interacted with locals in small villages, and even stopped at a local's home for coffee. This impromptu adventure made my trip truly memorable and showed me the beauty of spontaneous travel."
505," My most memorable travel experience was visiting the Great Wall of China. I climbed a less-touristed section, which meant I could enjoy the stunning views in relative solitude. The weather was perfect, and the physical challenge of the hike was invigorating."
506," I've always loved to travel, to experience new cultures and cuisines, and to seek out natural wonders. One of my most cherished memories was visiting the Great Barrier Reef in Australia. I remember the crystal clear waters and the vibrant corals teeming with marine life. It was like I was in a whole other world, and it was utterly breathtaking. The people I met were equally as remarkable, sharing their knowledge of the reef and showing me the best spots for snorkeling. It was an unforgettable"
507," I have countless positive experiences about travelling, but one that stands out is from my trip to Japan. I was lost in Tokyo and ended up in a small, bustling neighborhood filled with people going about their daily lives. I stopped at a tiny family-owned ramen shop, where the owner, a kind woman in her sixties, took the time to teach me a few Japanese phrases and laughed as I attempted to pronounce them. The warmth and genuine kindness of the people, along with the delicious ramen, turned what could have been a frustrating experience"
508," My best travel memory is from a volunteering trip to Costa Rica. I got to work with sea turtles, helping to release them into the ocean and it was incredibly rewarding to be part of their journey."
509," I once backpacked around Europe with my best friend, staying in hostels and meeting fellow travelers from all walks of life. It was a humbling and eye-opening experience that broadened my perspectives on cultures and ways of life, leaving me with unforgettable memories and lifelong friendships."
510," Travelling allows exploration of new cultures and cuisines, creating lasting memories and broadened perspectives. For instance, trying street food in Marrakech, Morocco, is a sensory experience that immerses you in local food culture."
511," Travelling broadened my horizons, allowing me to taste new cuisines, immerse in diverse cultures, and create lifelong friendships."
512,"I love exploring new places and experiencing different cultures. Seeing the Northern Lights in Iceland was a bucket list trip for me and I will never forget the natural beauty and wonder of it all."
513," Traveling has always been a passion of mine, but one of my most memorable experiences was when I backpacked through Southeast Asia. The vibrant culture, delicious street food, and warm-hearted locals made each day an adventure. I'll never forget the sunrise at Angkor Wat in Cambodia or the surreal beauty of the lantern-lit alleys in Hoi An, Vietnam. It was more than just a holiday; it was a journey of discovery that broadened my perspectives and filled my heart with unforgettable memories."
514," Positive experience about travelling could involve meeting new people, trying local cuisine, or a new cultural experience."
515," Travelling broadens horizons, fosters cultural understanding, and creates lifelong memories."
516," I once traveled to Italy and was amazed by the country's rich history and vibrant culture. I'll never forget wandering through the ancient streets of Rome, tasting delicious gelato in Florence, and experiencing the stunning art and architecture of Venice. It was a truly unforgettable experience that I'll cherish for a lifetime."
517," ""Exploring ancient ruins in the heart of Rome was an unforgettable experience that combined history and adventure. The lively atmosphere of the bustling city market in Marrakech left me with a sense of wonder and appreciation for diverse cultures. Witnessing the breathtaking aurora borealis in Iceland was a testament to the planet's natural beauty and the power of travel to inspire awe."""
518," It's a lifetime experience where we take in the local culture, taste delicious food, make new friends in different parts of the world."
519," It's about the unexpected joy of finding a small, local bakery in a tucked-away corner of Paris, where the aroma of freshly baked croissants and baguettes filled the air, and the baker, with his flour-dusted apron, greeted us warmly in French, making us feel like regulars. The pastries were divine, melt-in-your-mouth buttery goodness, and the experience felt authentic and untouristy, creating a lasting, happy memory."
520," Travelling allows me to explore new cultures, try delicious local cuisine, and immerse myself in the natural beauty of different landscapes, all while creating lasting memories and meeting interesting people from around the world."
521," Travelling brought me closer to nature's beauty during a hike in the mountains. Despite the challenging terrain, the sense of accomplishment when reaching the peak was exhilarating."
522,"I had an incredible time exploring the beautiful landscapes of New Zealand."
523," Remember to add 'And' at the beginning to connect it better.
And visiting the vibrant markets of Marrakech, I was captivated by the colors and energy, while the locals greeted me with warm smiles and delightful stories."
524," I cherish the moment when I discovered a small, traditional art shop nestled in a winding street of Florence. The owner, an elderly man with hands stained with decades of colorful pigments, eagerly shared stories about his craft and the history of Florence's art scene. It was like stepping into a time machine, creating a meaningful connection across cultures and generations."
525," Travelling broadened my horizons, immerse myself in new cultures, and formed lifelong friendships."
526," Traveling exposes you to new cultures, delicious foods, historical sites, and breathtaking landscapes. It fosters personal growth, broadens your perspectives, and creates lasting memories with fellow travelers and locals alike."
527,"I'd love to hear about your favorite trip!"
528," I love the way travel allows me to step out of my daily routine and immerse myself in new cultures, trying delicious local cuisine, exploring historical sites, and connecting with diverse people. It's invigorating and inspiring!"
529," I discovered a new love for hiking while exploring the Swiss Alps, the breathtaking views and fresh mountain air invigorated my spirit and connected me with fellow travelers in a profound way."
530," Travelling broadens perspectives, enabling individuals to immerse themselves in diverse cultures, tastes, and landscapes, thereby fostering personal growth and global understanding."
531," Traveling is an eye-opening experience. I met new friends from different parts of the world in a hostel, trying out local food, understanding their cultures, and exploring together made the journey even more memorable."
532," Exploring new cultures, trying local cuisine, and meeting friendly locals made my trip to Italy unforgettable."
533," Travelling broadened my horizons, exposed me to new cultures, and created lifelong friendships."
534," Once, my friend and I took a spontaneous overnight bus from Athens to Santorini, Greece. Despite the long journey, the views in the morning were breathtaking, and we instantly fell in love with the island. It was a memorable adventure that we wouldn't change for anything."
535," Travelling exposes us to diverse cultures, histories, and natural wonders, broadening our perspectives and fostering global understanding. It's an adventure that stimulates our senses, creates lifelong memories, and fills our hearts with gratitude for the beauty and richness of our world."
536," ""Traveling transforms you, it makes you more open-minded and understanding. I'll never forget the time I spent in Japan, immersing myself in a unique culture, trying new foods, and learning about their rich history. Every new place I visit leaves me inspired and with unforgettable memories."""
537," ""Travelling is an incredible way to learn about diverse cultures, broaden perspectives, and create lifelong memories. My favorite part was the spontaneous conversations with locals who shared insights into their daily lives and traditions, making me feel like a temporary resident rather than just a tourist."""
538," Exploring new cultures, trying exotic foods, and meeting fascinating people make traveling an unforgettable experience."
539," I'm still smiling from the joy of my last trip to Greece. Despite the language barrier, locals welcomed me with warm hearts and delicious food, making me feel like a well-loved family guest. The ancient ruins whispered tales of mythology, and the turquoise sea offered rejuvenating swims. Every sunset painted the sky with extraordinary hues, leaving me in awe of nature's mastery."
